[{"URL": "https://arxiv.org/abs/2310.10833", "abstract": "The ability to learn good representations of states is essential for solving large reinforcement learning problems, where exploration, generalization, and transfer are particularly challenging. The Laplacian representation is a promising approach to address these problems by inducing informative state encoding and intrinsic rewards for temporally-extended action discovery and reward shaping. To obtain the Laplacian representation one needs to compute the eigensystem of the graph Laplacian, which is often approximated through optimization objectives compatible with deep learning approaches. These approximations, however, depend on hyperparameters that are impossible to tune efficiently, converge to arbitrary rotations of the desired eigenvectors, and are unable to accurately recover the corresponding eigenvalues. In this paper we introduce a theoretically sound objective and corresponding optimization algorithm for approximating the Laplacian representation. Our approach naturally recovers both the true eigenvectors and eigenvalues while eliminating the hyperparameter dependence of previous approximations. We provide theoretical guarantees for our method and we show that those results translate empirically into robust learning across multiple environments.", "accessed": {"date-parts": [[2024, 10, 18]]}, "author": [{"family": "Gomez", "given": "Diego"}, {"family": "Bowling", "given": "Michael"}, {"family": "Machado", "given": "Marlos C."}], "id": "gomezProperLaplacianRepresentation2024", "issued": {"date-parts": [[2024, 4]]}, "keyword": "Computer Science - Artificial Intelligence,Computer Science - Machine Learning", "language": "en-US", "number": "arXiv:2310.10833", "publisher": "arXiv", "title": "Proper Laplacian Representation Learning", "type": "", "original_bibtex": "@misc{gomezProperLaplacianRepresentation2024,\n title = {Proper {{Laplacian Representation Learning}}},\n author = {Gomez, Diego and Bowling, Michael and Machado, Marlos C.},\n year = {2024},\n urldate = {2024-10-18},\n number = {arXiv:2310.10833},\n publisher = {arXiv},\n file = {/home/kellen/Zotero/storage/AGETEYXM/Gomez et al. - 2024 - Proper Laplacian Representation Learning.pdf},\n keywords = {Computer Science - Artificial Intelligence,Computer Science - Machine Learning},\n langid = {english},\n archiveprefix = {arXiv},\n abstract = {The ability to learn good representations of states is essential for solving large reinforcement learning problems, where exploration, generalization, and transfer are particularly challenging. The Laplacian representation is a promising approach to address these problems by inducing informative state encoding and intrinsic rewards for temporally-extended action discovery and reward shaping. To obtain the Laplacian representation one needs to compute the eigensystem of the graph Laplacian, which is often approximated through optimization objectives compatible with deep learning approaches. These approximations, however, depend on hyperparameters that are impossible to tune efficiently, converge to arbitrary rotations of the desired eigenvectors, and are unable to accurately recover the corresponding eigenvalues. In this paper we introduce a theoretically sound objective and corresponding optimization algorithm for approximating the Laplacian representation. Our approach naturally recovers both the true eigenvectors and eigenvalues while eliminating the hyperparameter dependence of previous approximations. We provide theoretical guarantees for our method and we show that those results translate empirically into robust learning across multiple environments.},\n primaryclass = {cs},\n eprint = {2310.10833},\n month = {April}\n}\n"}]