[{"DOI": "10.48550/arXiv.2405.07838", "URL": "https://arxiv.org/abs/2405.07838", "abstract": "General Value Functions (GVFs) (Sutton et al., 2011) represent predictive knowledge in reinforcement learning. Each GVF computes the expected return for a given policy, based on a unique reward. Existing methods relying on fixed behavior policies or pre-collected data often face data efficiency issues when learning multiple GVFs in parallel using off-policy methods. To address this, we introduce GVFExplorer, which adaptively learns a single behavior policy that efficiently collects data for evaluating multiple GVFs in parallel. Our method optimizes the behavior policy by minimizing the total variance in return across GVFs, thereby reducing the required environmental interactions. We use an existing temporal-difference-style variance estimator to approximate the return variance. We prove that each behavior policy update decreases the overall mean squared error in GVF predictions. We empirically show our method\u2019s performance in tabular and nonlinear function approximation settings, including Mujoco environments, with stationary and non-stationary reward signals, optimizing data usage and reducing prediction errors across multiple GVFs.", "accessed": {"date-parts": [[2024, 12, 18]]}, "author": [{"family": "Jain", "given": "Arushi"}, {"family": "Hanna", "given": "Josiah P."}, {"family": "Precup", "given": "Doina"}], "id": "jainAdaptiveExplorationDataEfficient2024", "issued": {"date-parts": [[2024, 10]]}, "keyword": "Computer Science - Artificial Intelligence,Computer Science - Machine Learning", "number": "arXiv:2405.07838", "publisher": "arXiv", "title": "Adaptive Exploration for Data-Efficient General Value Function Evaluations", "type": "", "original_bibtex": "@misc{jainAdaptiveExplorationDataEfficient2024,\n title = {Adaptive {{Exploration}} for {{Data-Efficient General Value Function Evaluations}}},\n author = {Jain, Arushi and Hanna, Josiah P. and Precup, Doina},\n year = {2024},\n doi = {10.48550/arXiv.2405.07838},\n urldate = {2024-12-18},\n number = {arXiv:2405.07838},\n publisher = {arXiv},\n file = {/home/kellenkanarios/Downloads/Papers/Continual-RL/Jain et al_2024_Adaptive Exploration for Data-Efficient General Value Function Evaluations.pdf;/home/kellen/Zotero/storage/SAPYRAL8/2405.html},\n keywords = {Computer Science - Artificial Intelligence,Computer Science - Machine Learning},\n archiveprefix = {arXiv},\n abstract = {General Value Functions (GVFs) (Sutton et al., 2011) represent predictive knowledge in reinforcement learning. Each GVF computes the expected return for a given policy, based on a unique reward. Existing methods relying on fixed behavior policies or pre-collected data often face data efficiency issues when learning multiple GVFs in parallel using off-policy methods. To address this, we introduce GVFExplorer, which adaptively learns a single behavior policy that efficiently collects data for evaluating multiple GVFs in parallel. Our method optimizes the behavior policy by minimizing the total variance in return across GVFs, thereby reducing the required environmental interactions. We use an existing temporal-difference-style variance estimator to approximate the return variance. We prove that each behavior policy update decreases the overall mean squared error in GVF predictions. We empirically show our method's performance in tabular and nonlinear function approximation settings, including Mujoco environments, with stationary and non-stationary reward signals, optimizing data usage and reducing prediction errors across multiple GVFs.},\n primaryclass = {cs},\n eprint = {2405.07838},\n month = {October}\n}\n"}]