[{"DOI": "10.1101/2021.07.21.453294", "abstract": "Long read sequencing is now routinely used at scale for genomics and transcriptomics applications. Mapping of long reads or a draft genome assembly to a reference sequence is often one of the most time consuming steps in these applications. Here, we present techniques to accelerate minimap2, a widely used software for mapping. We present multiple optimizations using SIMD parallelization, e cient cache utilization and a learned index data structure to accelerate its three main computational modules, i.e., seeding, chaining and pairwise sequence alignment. These result in reduction of end-to-end mapping time of minimap2 by up to 1.8\\RightArrowBar while maintaining identical output.", "accessed": {"date-parts": [[2024, 12, 11]]}, "author": [{"family": "Kalikar", "given": "Saurabh"}, {"family": "Jain", "given": "Chirag"}, {"family": "Md", "given": "Vasimuddin"}, {"family": "Misra", "given": "Sanchit"}], "id": "kalikarAcceleratingLongreadAnalysis2021", "issued": {"date-parts": [[2021, 7]]}, "language": "en-US", "title": "Accelerating long-read analysis on modern CPUs", "type": "", "original_bibtex": "@misc{kalikarAcceleratingLongreadAnalysis2021,\n title = {Accelerating Long-Read Analysis on Modern {{CPUs}}},\n author = {Kalikar, Saurabh and Jain, Chirag and Md, Vasimuddin and Misra, Sanchit},\n year = {2021},\n doi = {10.1101/2021.07.21.453294},\n urldate = {2024-12-11},\n file = {/home/kellen/Zotero/storage/FIX8U6F5/Kalikar et al. - 2021 - Accelerating long-read analysis on modern CPUs.pdf},\n langid = {english},\n abstract = {Long read sequencing is now routinely used at scale for genomics and transcriptomics applications. Mapping of long reads or a draft genome assembly to a reference sequence is often one of the most time consuming steps in these applications. Here, we present techniques to accelerate minimap2, a widely used software for mapping. We present multiple optimizations using SIMD parallelization, e cient cache utilization and a learned index data structure to accelerate its three main computational modules, i.e., seeding, chaining and pairwise sequence alignment. These result in reduction of end-to-end mapping time of minimap2 by up to 1.8{$\\RightArrowBar$} while maintaining identical output.},\n month = {July}\n}\n"}]