[{"DOI": "10.48550/arXiv.1312.6114", "URL": "https://arxiv.org/abs/1312.6114", "abstract": "How can we perform efficient inference and learning in directed probabilistic models, in the presence of continuous latent variables with intractable posterior distributions, and large datasets? We introduce a stochastic variational inference and learning algorithm that scales to large datasets and, under some mild differentiability conditions, even works in the intractable case. Our contributions are two-fold. First, we show that a reparameterization of the variational lower bound yields a lower bound estimator that can be straightforwardly optimized using standard stochastic gradient methods. Second, we show that for i.i.d. datasets with continuous latent variables per datapoint, posterior inference can be made especially efficient by fitting an approximate inference model (also called a recognition model) to the intractable posterior using the proposed lower bound estimator. Theoretical advantages are reflected in experimental results.", "accessed": {"date-parts": [[2025, 1, 7]]}, "author": [{"family": "Kingma", "given": "Diederik P."}, {"family": "Welling", "given": "Max"}], "id": "kingmaAutoEncodingVariationalBayes2022", "issued": {"date-parts": [[2022, 12]]}, "keyword": "Computer Science - Machine Learning,Statistics - Machine Learning", "language": "en-US", "number": "arXiv:1312.6114", "publisher": "arXiv", "title": "Auto-Encoding Variational Bayes", "type": "", "original_bibtex": "@misc{kingmaAutoEncodingVariationalBayes2022,\n title = {Auto-{{Encoding Variational Bayes}}},\n author = {Kingma, Diederik P. and Welling, Max},\n year = {2022},\n doi = {10.48550/arXiv.1312.6114},\n urldate = {2025-01-07},\n number = {arXiv:1312.6114},\n publisher = {arXiv},\n file = {/home/kellen/Zotero/storage/4CIQB3XP/1312.pdf},\n keywords = {Computer Science - Machine Learning,Statistics - Machine Learning},\n langid = {english},\n archiveprefix = {arXiv},\n abstract = {How can we perform efficient inference and learning in directed probabilistic models, in the presence of continuous latent variables with intractable posterior distributions, and large datasets? We introduce a stochastic variational inference and learning algorithm that scales to large datasets and, under some mild differentiability conditions, even works in the intractable case. Our contributions are two-fold. First, we show that a reparameterization of the variational lower bound yields a lower bound estimator that can be straightforwardly optimized using standard stochastic gradient methods. Second, we show that for i.i.d. datasets with continuous latent variables per datapoint, posterior inference can be made especially efficient by fitting an approximate inference model (also called a recognition model) to the intractable posterior using the proposed lower bound estimator. Theoretical advantages are reflected in experimental results.},\n primaryclass = {stat},\n eprint = {1312.6114},\n month = {December}\n}\n"}]