[{"URL": "https://arxiv.org/abs/2309.00267", "abstract": "Reinforcement learning from human feedback (RLHF) has proven effective in aligning large language models (LLMs) with human preferences, but gathering high-quality preference labels is expensive. RL from AI Feedback (RLAIF), introduced in Bai et al. (2022b), offers a promising alternative that trains the reward model (RM) on preferences generated by an off-the-shelf LLM. Across the tasks of summarization, helpful dialogue generation, and harmless dialogue generation, we show that RLAIF achieves comparable performance to RLHF. Furthermore, we take a step towards \u201cself-improvement\u201d by demonstrating that RLAIF can outperform a supervised finetuned baseline even when the AI labeler is the same size as the policy, or even the exact same checkpoint as the initial policy. Finally, we introduce direct-RLAIF (d-RLAIF) - a technique that circumvents RM training by obtaining rewards directly from an off-the-shelf LLM during RL, which achieves superior performance to canonical RLAIF. Our results suggest that RLAIF can achieve performance on-par with using human feedback, offering a potential solution to the scalability limitations of RLHF.", "accessed": {"date-parts": [[2024, 9, 11]]}, "author": [{"family": "Lee", "given": "Harrison"}, {"family": "Phatale", "given": "Samrat"}, {"family": "Mansoor", "given": "Hassan"}, {"family": "Mesnard", "given": "Thomas"}, {"family": "Ferret", "given": "Johan"}, {"family": "Lu", "given": "Kellie"}, {"family": "Bishop", "given": "Colton"}, {"family": "Hall", "given": "Ethan"}, {"family": "Carbune", "given": "Victor"}, {"family": "Rastogi", "given": "Abhinav"}, {"family": "Prakash", "given": "Sushant"}], "id": "leeRLAIFVsRLHF2024", "issued": {"date-parts": [[2024, 9]]}, "keyword": "Computer Science - Artificial Intelligence,Computer Science - Computation and Language,Computer Science - Machine Learning", "language": "en-US", "number": "arXiv:2309.00267", "publisher": "arXiv", "title": "RLAIF vs. RLHF: Scaling Reinforcement Learning from Human Feedback with AI Feedback", "title-short": "RLAIF vs. RLHF", "type": "", "original_bibtex": "@misc{leeRLAIFVsRLHF2024,\n title = {{{RLAIF}} vs. {{RLHF}}: {{Scaling Reinforcement Learning}} from {{Human Feedback}} with {{AI Feedback}}},\n author = {Lee, Harrison and Phatale, Samrat and Mansoor, Hassan and Mesnard, Thomas and Ferret, Johan and Lu, Kellie and Bishop, Colton and Hall, Ethan and Carbune, Victor and Rastogi, Abhinav and Prakash, Sushant},\n year = {2024},\n urldate = {2024-09-11},\n number = {arXiv:2309.00267},\n publisher = {arXiv},\n file = {/home/kellen/Zotero/storage/IWPVFZCM/Lee et al. - 2024 - RLAIF vs. RLHF Scaling Reinforcement Learning from Human Feedback with AI Feedback.pdf},\n keywords = {Computer Science - Artificial Intelligence,Computer Science - Computation and Language,Computer Science - Machine Learning},\n langid = {english},\n archiveprefix = {arXiv},\n abstract = {Reinforcement learning from human feedback (RLHF) has proven effective in aligning large language models (LLMs) with human preferences, but gathering high-quality preference labels is expensive. RL from AI Feedback (RLAIF), introduced in Bai et al. (2022b), offers a promising alternative that trains the reward model (RM) on preferences generated by an off-the-shelf LLM. Across the tasks of summarization, helpful dialogue generation, and harmless dialogue generation, we show that RLAIF achieves comparable performance to RLHF. Furthermore, we take a step towards ``self-improvement'' by demonstrating that RLAIF can outperform a supervised finetuned baseline even when the AI labeler is the same size as the policy, or even the exact same checkpoint as the initial policy. Finally, we introduce direct-RLAIF (d-RLAIF) - a technique that circumvents RM training by obtaining rewards directly from an off-the-shelf LLM during RL, which achieves superior performance to canonical RLAIF. Our results suggest that RLAIF can achieve performance on-par with using human feedback, offering a potential solution to the scalability limitations of RLHF.},\n primaryclass = {cs},\n eprint = {2309.00267},\n month = {September},\n shorttitle = {{{RLAIF}} vs. {{RLHF}}}\n}\n"}]