[{"author": [{"family": "Brown", "given": "Tom"}, {"family": "Mann", "given": "Benjamin"}, {"family": "Ryder", "given": "Nick"}, {"family": "Subbiah", "given": "Melanie"}, {"family": "Kaplan", "given": "Jared D"}, {"family": "Dhariwal", "given": "Prafulla"}, {"family": "Neelakantan", "given": "Arvind"}, {"family": "Shyam", "given": "Pranav"}, {"family": "Sastry", "given": "Girish"}, {"family": "Askell", "given": "Amanda"}, {"family": "Agarwal", "given": "Sandhini"}, {"family": "Herbert-Voss", "given": "Ariel"}, {"family": "Krueger", "given": "Gretchen"}, {"family": "Henighan", "given": "Tom"}, {"family": "Child", "given": "Rewon"}, {"family": "Ramesh", "given": "Aditya"}, {"family": "Ziegler", "given": "Daniel"}, {"family": "Wu", "given": "Jeffrey"}, {"family": "Winter", "given": "Clemens"}, {"family": "Hesse", "given": "Chris"}, {"family": "Chen", "given": "Mark"}, {"family": "Sigler", "given": "Eric"}, {"family": "Litwin", "given": "Mateusz"}, {"family": "Gray", "given": "Scott"}, {"family": "Chess", "given": "Benjamin"}, {"family": "Clark", "given": "Jack"}, {"family": "Berner", "given": "Christopher"}, {"family": "McCandlish", "given": "Sam"}, {"family": "Radford", "given": "Alec"}, {"family": "Sutskever", "given": "Ilya"}, {"family": "Amodei", "given": "Dario"}], "container-title": "Advances in neural information processing systems", "editor": [{"family": "Larochelle", "given": "H."}, {"family": "Ranzato", "given": "M."}, {"family": "Hadsell", "given": "R."}, {"family": "Balcan", "given": "M. F."}, {"family": "Lin", "given": "H."}], "id": "NEURIPS2020_1457c0d6", "issued": {"date-parts": [[2020]]}, "page": "1877-1901", "publisher": "Curran Associates, Inc.", "title": "Language models are few-shot learners", "type": "paper-conference", "volume": "33", "original_bibtex": "@inproceedings{NEURIPS2020_1457c0d6,\n title = {Language Models Are Few-Shot Learners},\n author = {Brown, Tom and Mann, Benjamin and Ryder, Nick and Subbiah, Melanie and Kaplan, Jared D and Dhariwal, Prafulla and Neelakantan, Arvind and Shyam, Pranav and Sastry, Girish and Askell, Amanda and Agarwal, Sandhini and {Herbert-Voss}, Ariel and Krueger, Gretchen and Henighan, Tom and Child, Rewon and Ramesh, Aditya and Ziegler, Daniel and Wu, Jeffrey and Winter, Clemens and Hesse, Chris and Chen, Mark and Sigler, Eric and Litwin, Mateusz and Gray, Scott and Chess, Benjamin and Clark, Jack and Berner, Christopher and McCandlish, Sam and Radford, Alec and Sutskever, Ilya and Amodei, Dario},\n year = {2020},\n booktitle = {Advances in Neural Information Processing Systems},\n editor = {Larochelle, H. and Ranzato, M. and Hadsell, R. and Balcan, M.F. and Lin, H.},\n volume = {33},\n pages = {1877--1901},\n publisher = {Curran Associates, Inc.}\n}\n"}]