[{"URL": "https://arxiv.org/abs/1807.03748", "abstract": "While supervised learning has enabled great progress in many applications, unsupervised learning has not seen such widespread adoption, and remains an important and challenging endeavor for artificial intelligence. In this work, we propose a universal unsupervised learning approach to extract useful representations from high-dimensional data, which we call Contrastive Predictive Coding. The key insight of our model is to learn such representations by predicting the future in latent space by using powerful autoregressive models. We use a probabilistic contrastive loss which induces the latent space to capture information that is maximally useful to predict future samples. It also makes the model tractable by using negative sampling. While most prior work has focused on evaluating representations for a particular modality, we demonstrate that our approach is able to learn useful representations achieving strong performance on four distinct domains: speech, images, text and reinforcement learning in 3D environments.", "accessed": {"date-parts": [[2024, 11, 21]]}, "author": [{"dropping-particle": "van den", "family": "Oord", "given": "Aaron"}, {"family": "Li", "given": "Yazhe"}, {"family": "Vinyals", "given": "Oriol"}], "id": "oordRepresentationLearningContrastive2019", "issued": {"date-parts": [[2019, 1]]}, "keyword": "Computer Science - Machine Learning,Statistics - Machine Learning", "language": "en-US", "number": "arXiv:1807.03748", "publisher": "arXiv", "title": "Representation Learning with Contrastive Predictive Coding", "type": "", "original_bibtex": "@misc{oordRepresentationLearningContrastive2019,\n title = {Representation {{Learning}} with {{Contrastive Predictive Coding}}},\n author = {van den Oord, Aaron and Li, Yazhe and Vinyals, Oriol},\n year = {2019},\n urldate = {2024-11-21},\n number = {arXiv:1807.03748},\n publisher = {arXiv},\n file = {/home/kellen/Zotero/storage/8ZBPFQEK/Oord et al. - 2019 - Representation Learning with Contrastive Predictive Coding.pdf;/home/kellen/Zotero/storage/H9PLPKN6/Oord et al. - 2019 - Representation Learning with Contrastive Predictive Coding.pdf},\n keywords = {Computer Science - Machine Learning,Statistics - Machine Learning},\n langid = {english},\n archiveprefix = {arXiv},\n abstract = {While supervised learning has enabled great progress in many applications, unsupervised learning has not seen such widespread adoption, and remains an important and challenging endeavor for artificial intelligence. In this work, we propose a universal unsupervised learning approach to extract useful representations from high-dimensional data, which we call Contrastive Predictive Coding. The key insight of our model is to learn such representations by predicting the future in latent space by using powerful autoregressive models. We use a probabilistic contrastive loss which induces the latent space to capture information that is maximally useful to predict future samples. It also makes the model tractable by using negative sampling. While most prior work has focused on evaluating representations for a particular modality, we demonstrate that our approach is able to learn useful representations achieving strong performance on four distinct domains: speech, images, text and reinforcement learning in 3D environments.},\n primaryclass = {cs},\n eprint = {1807.03748},\n month = {January}\n}\n"}]