[{"URL": "https://arxiv.org/abs/1910.02054", "abstract": "Large deep learning models offer significant accuracy gains, but training billions to trillions of parameters is challenging. Existing solutions such as data and model parallelisms exhibit fundamental limitations to fit these models into limited device memory, while obtaining computation, communication and development efficiency. We develop a novel solution, Zero Redundancy Optimizer (ZeRO), to optimize memory, vastly improving training speed while increasing the model size that can be efficiently trained. ZeRO eliminates memory redundancies in data- and model-parallel training while retaining low communication volume and high computational granularity, allowing us to scale the model size proportional to the number of devices with sustained high efficiency. Our analysis on memory requirements and communication volume demonstrates: ZeRO has the potential to scale beyond 1 Trillion parameters using today\u2019s hardware.", "accessed": {"date-parts": [[2024, 9, 18]]}, "author": [{"family": "Rajbhandari", "given": "Samyam"}, {"family": "Rasley", "given": "Jeff"}, {"family": "Ruwase", "given": "Olatunji"}, {"family": "He", "given": "Yuxiong"}], "id": "rajbhandariZeROMemoryOptimizations2020", "issued": {"date-parts": [[2020, 5]]}, "keyword": "Computer Science - Distributed Parallel and Cluster Computing,Computer Science - Machine Learning,Statistics - Machine Learning", "language": "en-US", "number": "arXiv:1910.02054", "publisher": "arXiv", "title": "ZeRO: Memory Optimizations Toward Training Trillion Parameter Models", "title-short": "ZeRO", "type": "", "original_bibtex": "@misc{rajbhandariZeROMemoryOptimizations2020,\n title = {{{ZeRO}}: {{Memory Optimizations Toward Training Trillion Parameter Models}}},\n author = {Rajbhandari, Samyam and Rasley, Jeff and Ruwase, Olatunji and He, Yuxiong},\n year = {2020},\n urldate = {2024-09-18},\n number = {arXiv:1910.02054},\n publisher = {arXiv},\n file = {/home/kellen/Zotero/storage/FDXIZE3Y/Rajbhandari et al. - 2020 - ZeRO Memory Optimizations Toward Training Trillion Parameter Models.pdf},\n keywords = {Computer Science - Distributed Parallel and Cluster Computing,Computer Science - Machine Learning,Statistics - Machine Learning},\n langid = {english},\n archiveprefix = {arXiv},\n abstract = {Large deep learning models offer significant accuracy gains, but training billions to trillions of parameters is challenging. Existing solutions such as data and model parallelisms exhibit fundamental limitations to fit these models into limited device memory, while obtaining computation, communication and development efficiency. We develop a novel solution, Zero Redundancy Optimizer (ZeRO), to optimize memory, vastly improving training speed while increasing the model size that can be efficiently trained. ZeRO eliminates memory redundancies in data- and model-parallel training while retaining low communication volume and high computational granularity, allowing us to scale the model size proportional to the number of devices with sustained high efficiency. Our analysis on memory requirements and communication volume demonstrates: ZeRO has the potential to scale beyond 1 Trillion parameters using today's hardware.},\n primaryclass = {cs, stat},\n eprint = {1910.02054},\n month = {May},\n shorttitle = {{{ZeRO}}}\n}\n"}]