[{"DOI": "10.48550/arXiv.2108.02827", "URL": "https://arxiv.org/abs/2108.02827", "abstract": "Watkins\u2019 and Dayan\u2019s Q-learning is a model-free reinforcement learning algorithm that iteratively refines an estimate for the optimal action-value function of an MDP by stochastically \"visiting\" many state-ation pairs [Watkins and Dayan, 1992]. Variants of the algorithm lie at the heart of numerous recent state-of-the-art achievements in reinforcement learning, including the superhuman Atari-playing deep Q-network [Mnih et al., 2015]. The goal of this paper is to reproduce a precise and (nearly) self-contained proof that Q-learning converges. Much of the available literature leverages powerful theory to obtain highly generalizable results in this vein. However, this approach requires the reader to be familiar with and make many deep connections to different research areas. A student seeking to deepen their understand of Q-learning risks becoming caught in a vicious cycle of \"RL-learning Hell\". For this reason, we give a complete proof from start to finish using only one external result from the field of stochastic approximation, despite the fact that this minimal dependence on other results comes at the expense of some \"shininess\".", "accessed": {"date-parts": [[2025, 1, 23]]}, "author": [{"family": "Regehr", "given": "Matthew T."}, {"family": "Ayoub", "given": "Alex"}], "id": "regehrElementaryProofThat2021", "issued": {"date-parts": [[2021, 8]]}, "keyword": "Computer Science - Machine Learning", "language": "en-US", "number": "arXiv:2108.02827", "publisher": "arXiv", "title": "An Elementary Proof that Q-learning Converges Almost Surely", "type": "", "original_bibtex": "@misc{regehrElementaryProofThat2021,\n title = {An {{Elementary Proof}} That {{Q-learning Converges Almost Surely}}},\n author = {Regehr, Matthew T. and Ayoub, Alex},\n year = {2021},\n doi = {10.48550/arXiv.2108.02827},\n urldate = {2025-01-23},\n number = {arXiv:2108.02827},\n publisher = {arXiv},\n file = {/home/kellen/Zotero/storage/FLMMCTDT/Regehr and Ayoub - 2021 - An Elementary Proof that Q-learning Converges Almost Surely.pdf},\n keywords = {Computer Science - Machine Learning},\n langid = {english},\n archiveprefix = {arXiv},\n abstract = {Watkins' and Dayan's Q-learning is a model-free reinforcement learning algorithm that iteratively refines an estimate for the optimal action-value function of an MDP by stochastically \"visiting\" many state-ation pairs [Watkins and Dayan, 1992]. Variants of the algorithm lie at the heart of numerous recent state-of-the-art achievements in reinforcement learning, including the superhuman Atari-playing deep Q-network [Mnih et al., 2015]. The goal of this paper is to reproduce a precise and (nearly) self-contained proof that Q-learning converges. Much of the available literature leverages powerful theory to obtain highly generalizable results in this vein. However, this approach requires the reader to be familiar with and make many deep connections to different research areas. A student seeking to deepen their understand of Q-learning risks becoming caught in a vicious cycle of \"RL-learning Hell\". For this reason, we give a complete proof from start to finish using only one external result from the field of stochastic approximation, despite the fact that this minimal dependence on other results comes at the expense of some \"shininess\".},\n primaryclass = {cs},\n eprint = {2108.02827},\n month = {August}\n}\n"}]